{"schemaId":"tde.evidence","schemaVersion":"1.0.0","runtime":{"id":"tde","version":"0.1.0"},"executionId":"execution.partial","repository":{"id":"repository.partial","displayName":"Partial"},"candidate":{"id":"candidate.partial","identityType":"declared","validationStatus":"UNAVAILABLE"},"configurationDigest":"sha256:config","capabilityResults":[{"capabilityId":"test_health","capabilityVersion":"1.0.0","status":"PARTIAL","completeness":0.5,"qualificationApplicable":false,"limitations":[{"id":"limitation.analyzer","description":"Analyzer unavailable","cause":"tool missing"}]}],"validation":{"status":"INCOMPLETE","schema":"VALID","candidateIdentity":"UNAVAILABLE","repositoryIdentity":"VALID","adapter":"INCOMPLETE","analyzer":"UNAVAILABLE","completeness":"PARTIAL","integrity":"VALID"},"timestamps":{"executedAt":"2026-01-01T00:00:00Z","generatedAt":"2026-01-01T00:00:00Z"},"integrity":{"algorithm":"sha-256","contentDigest":"sha256:partial"}}
