{"schemaId":"tde.evidence","schemaVersion":"1.0.0","runtime":{"id":"tde","version":"0.1.0"},"executionId":"execution.example.1","repository":{"id":"repository.example","displayName":"Example"},"candidate":{"id":"candidate.example","identityType":"content_digest","value":"sha256:example","validationStatus":"VALID"},"configurationDigest":"sha256:config","capabilityResults":[{"capabilityId":"code_size","capabilityVersion":"1.0.0","status":"VALID","completeness":1,"qualificationApplicable":true}],"validation":{"status":"VALID","schema":"VALID","candidateIdentity":"VALID","repositoryIdentity":"VALID","adapter":"VALID","analyzer":"VALID","completeness":"COMPLETE","integrity":"VALID"},"timestamps":{"executedAt":"2026-01-01T00:00:00Z","generatedAt":"2026-01-01T00:00:00Z"},"integrity":{"algorithm":"sha-256","contentDigest":"sha256:evidence"}}
