{"schemaId":"tde.evidence","schemaVersion":"1.0.0","runtime":{"id":"tde","version":"0.1.0"},"executionId":"execution.unsupported","repository":{"id":"repository.example","displayName":"Example"},"candidate":{"id":"candidate.example","identityType":"content_digest","value":"sha256:example","validationStatus":"VALID"},"configurationDigest":"sha256:config","capabilityResults":[{"capabilityId":"architecture_health","capabilityVersion":"1.0.0","status":"NOT_SUPPORTED","completeness":0,"qualificationApplicable":false}],"validation":{"status":"UNSUPPORTED","schema":"VALID","candidateIdentity":"VALID","repositoryIdentity":"VALID","adapter":"UNSUPPORTED","analyzer":"UNSUPPORTED","completeness":"NONE","integrity":"VALID"},"timestamps":{"executedAt":"2026-01-01T00:00:00Z","generatedAt":"2026-01-01T00:00:00Z"},"integrity":{"algorithm":"sha-256","contentDigest":"sha256:unsupported"}}
