{"schemaId":"tde.evidence","schemaVersion":"1.0.0","runtime":{"id":"tde","version":"0.1.0"},"executionId":"execution.example.2","repository":{"id":"repository.polyglot","displayName":"Polyglot"},"candidate":{"id":"candidate.polyglot","identityType":"content_digest","value":"sha256:polyglot","validationStatus":"VALID"},"configurationDigest":"sha256:config","capabilityResults":[{"capabilityId":"complexity","capabilityVersion":"1.0.0","status":"VALID","adapterIds":["python.adapter","typescript.adapter"],"completeness":1,"qualificationApplicable":true}],"measurements":[{"measurementId":"measurement.1","capabilityId":"complexity","metricKey":"complexity.cyclomatic","value":4,"unit":"count","scope":"function","targetEntityId":"function.example","aggregation":"maximum","sourceAdapterId":"python.adapter","sourceToolId":"tool.example"}],"findings":[],"validation":{"status":"VALID","schema":"VALID","candidateIdentity":"VALID","repositoryIdentity":"VALID","adapter":"VALID","analyzer":"VALID","completeness":"COMPLETE","integrity":"VALID"},"timestamps":{"executedAt":"2026-01-01T00:00:00Z","generatedAt":"2026-01-01T00:00:00Z"},"integrity":{"algorithm":"sha-256","contentDigest":"sha256:evidence2"}}
